{
  "task_id": "task-001",
  "competition_id": "cumcm",
  "family_id": "cumcm-default",
  "family_version": 1,
  "format": "latex",
  "ruleset_id": "cumcm-2026",
  "ruleset_version": 1,
  "ruleset_status": "pending_verification",
  "rules_compliance": "unverified",
  "local_resources": [
    {
      "asset_ref": {
        "asset_id": "cumcm-layout-latex",
        "version": 1,
        "sha256": "5c59c76c9f0fc02c0f8794069ca2dbd82b5f449e52f2e48bba1d5b09c33d6ef1"
      },
      "relative_path": "cache/cumcm-layout-latex.json",
      "verified": true
    },
    {
      "asset_ref": {
        "asset_id": "cumcm-outline",
        "version": 1,
        "sha256": "735e623bf288b29cf96ea3e269a3d3a7169fdab96bc397ae5214b6dd2ff87176"
      },
      "relative_path": "cache/cumcm-outline.json",
      "verified": true
    },
    {
      "asset_ref": {
        "asset_id": "cumcm-policy",
        "version": 1,
        "sha256": "2171172da7c6e162fb55afe0c178b1f41f9b652322007cdb03df5925a034279d"
      },
      "relative_path": "cache/cumcm-policy.json",
      "verified": true
    },
    {
      "asset_ref": {
        "asset_id": "cumcm-figure",
        "version": 1,
        "sha256": "7676476536c298b5946e6d855f01ea21acd58f17aaadd7deb64ea9d45e5054f8"
      },
      "relative_path": "cache/cumcm-figure.json",
      "verified": true
    },
    {
      "asset_ref": {
        "asset_id": "cumcm-table",
        "version": 1,
        "sha256": "2ca054dce33a9adf3c59e5d4fe8105aa93c36b9f82250c20a9de31b7217049e5"
      },
      "relative_path": "cache/cumcm-table.json",
      "verified": true
    },
    {
      "asset_ref": {
        "asset_id": "cumcm-rules",
        "version": 1,
        "sha256": "02cd1e8408dd6e726b60e8cc9e4a88cb943f7a9a1d0bb92be4c10db5881db724"
      },
      "relative_path": "cache/cumcm-rules.json",
      "verified": true
    },
    {
      "asset_ref": {
        "asset_id": "cumcm-case-001-profile",
        "version": 1,
        "sha256": "bbe16d93cbd718e54d5ebc3948f76224b983dfa8496c471eb69558e60b8ef6e5"
      },
      "relative_path": "cache/cumcm-case-001-profile.json",
      "verified": true
    }
  ],
  "candidate_profiles": [
    {
      "case_id": "cumcm-2024-B-case-001",
      "profile_version": 1,
      "source_sha256": "e3b0c44298fc1c149afbf4c8996fb92427ae41e4649b934ca495991b7852b855",
      "profile_asset_ref": {
        "asset_id": "cumcm-case-001-profile",
        "version": 1,
        "sha256": "bbe16d93cbd718e54d5ebc3948f76224b983dfa8496c471eb69558e60b8ef6e5"
      }
    }
  ],
  "style_ref": {
    "asset_id": "cumcm-figure",
    "version": 1,
    "sha256": "7676476536c298b5946e6d855f01ea21acd58f17aaadd7deb64ea9d45e5054f8"
  },
  "schema_version": 1,
  "model_execution": "local_only",
  "is_fixture": true
}
